<?xml version="1.0"?>
<program xsi:schemaLocation="http://www.w3schools.com tas.xsd" xmlns="http://www.w3schools.com" xmlns:xsi="http://www.w3.org/2001/XMLSchema-instance">
   <threads>
      <thread cluster="0" core="0" id="0" routine="demo_5_main_core_0"/>
      <thread cluster="0" core="1" id="1" routine="tas_thread"/>
      <thread cluster="1" core="0" id="2" routine="tas_thread"/>
      <thread cluster="1" core="1" id="3" routine="tas_thread"/>
      <thread cluster="2" core="0" id="4" routine="tas_thread"/>
      <thread cluster="2" core="1" id="5" routine="tas_thread"/>
      <thread cluster="3" core="0" id="6" routine="tas_thread"/>
      <thread cluster="3" core="1" id="7" routine="tas_thread"/>
   </threads>
   <tas_dataparallelisms>
      <tas_dataparallelism id="genetic_dp_execute" description="Genetic Algorithm" main_as_worker="1" nr_args="8">
         <threads>
            <thread ref="0" main="1"/>
            <thread ref="1"/>
            <thread ref="2"/>
            <thread ref="3"/>
            <thread ref="4"/>
            <thread ref="5"/>
            <thread ref="6"/>
            <thread ref="7"/>
         </threads>
         <task function="init_and_evaluate"/>
      </tas_dataparallelism>
   </tas_dataparallelisms>
   <csections>
      <!-- additional csection for random number generator -->
      <csection id="rando_lock" description="Random Number Generator">
         <thread id="0,1,2,3,4,5,6,7"/>
      </csection>
   </csections>
</program>